{
  "schemaVersion": 1,
  "family": "F3",
  "familyName": "scripts",
  "generator": "scripts/render-reference.mjs",
  "members": [
    {
      "name": "apply-husky-patch.sh",
      "kind": "script",
      "shipsTo": {
        "tier": "framework",
        "absent": "no-lane"
      },
      "description": "apply a prepared patch to a .husky/** hook through the sanctioned channel.",
      "source": {
        "path": "scripts/apply-husky-patch.sh",
        "line": 2
      },
      "extras": {
        "wired-from": [
          ".agents/hooks/apply-husky-patch-gate.sh:24 (quoted-path-token)"
        ]
      },
      "example": null
    },
    {
      "name": "build-getff-dist.sh",
      "kind": "script",
      "shipsTo": {
        "tier": "framework",
        "absent": "no-lane"
      },
      "description": "assemble the `getff` distribution package (packages/getff) from the repo root.",
      "source": {
        "path": "scripts/build-getff-dist.sh",
        "line": 2
      },
      "extras": {
        "wired-from": [
          "packages/core/hooks/pre-push.ts:1801 (spawn-argument)",
          "package.json:1 (json-value:invocation-verb)",
          "package.json:1 (json-value:invocation-verb)",
          "scripts/run-local-ci-sweep.sh:301 (quoted-path-token, closure)"
        ]
      },
      "example": null
    },
    {
      "name": "build-runtime-bundles.mjs",
      "kind": "script",
      "shipsTo": {
        "tier": "framework",
        "absent": "no-lane"
      },
      "description": "prebuild the pre-push hook and the rule generator as .mjs bundles.",
      "source": {
        "path": "scripts/build-runtime-bundles.mjs",
        "line": 3
      },
      "extras": {
        "wired-from": [
          "packages/core/hooks/pre-push.ts:1652 (spawn-argument)",
          ".github/workflows/audit-self.yml:614 (workflow-run:invocation-verb)"
        ]
      },
      "example": null
    },
    {
      "name": "build-shipped-eslint-rules.sh",
      "kind": "script",
      "shipsTo": {
        "tier": "framework",
        "absent": "no-lane"
      },
      "description": "Variant A / Option A (fixes #752).",
      "source": {
        "path": "scripts/build-shipped-eslint-rules.sh",
        "line": 2
      },
      "extras": {
        "wired-from": [
          "packages/core/hooks/pre-push.ts:1698 (spawn-argument)",
          ".github/workflows/audit-self.yml:580 (workflow-run:invocation-verb)"
        ]
      },
      "example": null
    },
    {
      "name": "build-synth-bundle.sh",
      "kind": "script",
      "shipsTo": {
        "tier": "framework",
        "absent": "no-lane"
      },
      "description": "Bundle synth-and-wire.ts into a zero-runtime-dep .mjs (#755).",
      "source": {
        "path": "scripts/build-synth-bundle.sh",
        "line": 2
      },
      "extras": {
        "wired-from": [
          "packages/core/hooks/pre-push.ts:1585 (spawn-argument)",
          ".github/workflows/audit-self.yml:585 (workflow-run:invocation-verb)",
          "package.json:1 (json-value:invocation-verb)",
          "package.json:1 (json-value:invocation-verb)"
        ]
      },
      "example": null
    },
    {
      "name": "census.mjs",
      "kind": "script",
      "shipsTo": {
        "tier": "framework",
        "absent": "no-lane"
      },
      "description": "the F.3 wiring-surface line classifier (input class 7, ref-gen §7 row 7).",
      "source": {
        "path": "scripts/census.mjs",
        "line": 3
      },
      "extras": {
        "wired-from": [
          "scripts/render-reference.mjs:55 (es-import, closure)"
        ]
      },
      "example": null
    },
    {
      "name": "check-alwayson-budget.sh",
      "kind": "script",
      "shipsTo": {
        "tier": "framework",
        "absent": "no-lane"
      },
      "description": "pre-push drift-guard: fail if the always-on context baseline exceeds the ceiling set by arch-v2-context-pipeline S-E",
      "source": {
        "path": "scripts/check-alwayson-budget.sh",
        "line": 2
      },
      "extras": {
        "wired-from": [
          "packages/core/hooks/pre-push.ts:2368 (spawn-argument)",
          ".github/workflows/audit-self.yml:1512 (workflow-run:invocation-verb)"
        ]
      },
      "example": null
    },
    {
      "name": "check-arch-retell.mjs",
      "kind": "script",
      "shipsTo": {
        "tier": "framework",
        "absent": "no-lane"
      },
      "description": "every point of an /arch consensus retell names where it came from.",
      "source": {
        "path": "scripts/check-arch-retell.mjs",
        "line": 3
      },
      "extras": {
        "wired-from": [
          ".github/workflows/audit-self.yml:2688 (workflow-run:invocation-verb)",
          ".husky/pre-commit:241 (quoted-path-token)"
        ]
      },
      "example": null
    },
    {
      "name": "check-ask-files.sh",
      "kind": "script",
      "shipsTo": {
        "tier": "framework",
        "absent": "no-lane"
      },
      "description": "ask-file schema validity + the answered⇒decisions-entry cross-check.",
      "source": {
        "path": ".agents/checks/check-ask-files.sh",
        "line": 2
      },
      "extras": {
        "wired-from": [
          "packages/core/hooks/pre-push.ts:2401 (spawn-argument)",
          "install.sh:1228 (quoted-path-token)"
        ]
      },
      "example": null
    },
    {
      "name": "check-bash32.sh",
      "kind": "script",
      "shipsTo": {
        "tier": "framework",
        "absent": "no-lane"
      },
      "description": "refuse bash-4-only syntax and BSD-userland traps in the shell that install.sh",
      "source": {
        "path": "scripts/check-bash32.sh",
        "line": 2
      },
      "extras": {
        "wired-from": [
          "packages/core/hooks/pre-push.ts:2429 (spawn-argument)",
          ".github/workflows/audit-self.yml:2875 (workflow-run:invocation-verb)"
        ]
      },
      "example": null
    },
    {
      "name": "check-bundle-dep-parity.sh",
      "kind": "script",
      "shipsTo": {
        "tier": "framework",
        "absent": "no-lane"
      },
      "description": "guard against PHANTOM bundle drift.",
      "source": {
        "path": "scripts/check-bundle-dep-parity.sh",
        "line": 2
      },
      "extras": {
        "wired-from": [
          "scripts/build-synth-bundle.sh:52 (quoted-path-token, closure)"
        ]
      },
      "example": null
    },
    {
      "name": "check-docs-refresh.mjs",
      "kind": "script",
      "shipsTo": {
        "tier": "framework",
        "absent": "no-lane"
      },
      "description": "the D26 refresh MERGE GATE (getff-ai-site R13).",
      "source": {
        "path": "scripts/check-docs-refresh.mjs",
        "line": 3
      },
      "extras": {
        "wired-from": [
          ".github/workflows/audit-self.yml:2624 (workflow-run:invocation-verb)"
        ]
      },
      "example": null
    },
    {
      "name": "check-line-citations.mjs",
      "kind": "script",
      "shipsTo": {
        "tier": "framework",
        "absent": "no-lane"
      },
      "description": "`path:line` citation drift gate.",
      "source": {
        "path": "scripts/check-line-citations.mjs",
        "line": 3
      },
      "extras": {
        "wired-from": [
          ".github/workflows/audit-self.yml:2673 (workflow-run:invocation-verb)",
          ".husky/pre-commit:181 (quoted-path-token)"
        ]
      },
      "example": null
    },
    {
      "name": "check-pipefail-early-exit.mjs",
      "kind": "script",
      "shipsTo": {
        "tier": "framework",
        "absent": "no-lane"
      },
      "description": "refuse a pipe into an early-exiting `grep` in a shell script that",
      "source": {
        "path": "scripts/check-pipefail-early-exit.mjs",
        "line": 3
      },
      "extras": {
        "wired-from": [
          ".github/workflows/audit-self.yml:812 (workflow-run:invocation-verb)",
          ".husky/pre-commit:203 (quoted-path-token)"
        ]
      },
      "example": null
    },
    {
      "name": "check-ships-manifest.mjs",
      "kind": "script",
      "shipsTo": {
        "tier": "framework",
        "absent": "no-lane"
      },
      "description": "fails when a getff skill, hook, rule, agent, setting, MCP server or docs-gate script is unmarked.",
      "source": {
        "path": "scripts/check-ships-manifest.mjs",
        "line": 3
      },
      "extras": {
        "wired-from": [
          ".github/workflows/audit-self.yml:2722 (workflow-run:invocation-verb)",
          ".husky/pre-commit:223 (quoted-path-token)"
        ]
      },
      "example": null
    },
    {
      "name": "check-skill-drift.sh",
      "kind": "script",
      "shipsTo": {
        "tier": "framework",
        "absent": "no-lane"
      },
      "description": "skill/agent file drift detector",
      "source": {
        "path": "scripts/check-skill-drift.sh",
        "line": 2
      },
      "extras": {
        "wired-from": [
          "packages/core/hooks/pre-push.ts:1142 (spawn-argument)",
          "package.json:1 (json-value:invocation-verb)"
        ]
      },
      "example": null
    },
    {
      "name": "ci-path-scope.sh",
      "kind": "script",
      "shipsTo": {
        "tier": "framework",
        "absent": "no-lane"
      },
      "description": "decide whether audit-self.yml's install-area jobs must run for this event.",
      "source": {
        "path": "scripts/ci-path-scope.sh",
        "line": 2
      },
      "extras": {
        "wired-from": [
          ".github/workflows/audit-self.yml:44 (workflow-run:invocation-verb)"
        ]
      },
      "example": null
    },
    {
      "name": "ci-success-gate.sh",
      "kind": "script",
      "shipsTo": {
        "tier": "framework",
        "absent": "no-lane"
      },
      "description": "aggregate pass/fail gate for the `ci-success` job.",
      "source": {
        "path": "scripts/ci-success-gate.sh",
        "line": 2
      },